Pokemon,Description
Electabuzz,"When a storm arrives, gangs of this Pokémon compete with each other to scale heights that are likely to be stricken by lightning bolts. Some towns use Electabuzz in place of lightning rods."
Scyther,"Scyther is blindingly fast. Its blazing speed enhances the effectiveness of the twin scythes on its forearms. This Pokémon’s scythes are so effective, they can slice through thick logs in one wicked stroke."
Staryu,"Staryu apparently communicates with the stars in the night sky by flashing the red core at the center of its body. If parts of its body are torn, this Pokémon simply regenerates the missing pieces and limbs."
Starmie,Starmie swims through water by spinning its star-shaped body as if it were a propeller on a ship. The core at the center of this Pokémon’s body glows in seven colors.
Seaking,Seaking is very protective of its eggs. The male and female will take turns patrolling around their nest and eggs. The guarding of eggs by these Pokémon goes on for over a month.
Seadra,"Seadra generates whirlpools by spinning its body. The whirlpools are strong enough to swallow even fishing boats. This Pokémon weakens prey with these currents, then swallows it whole."
Goldeen,"Goldeen loves swimming wild and free in rivers and ponds. If one of these Pokémon is placed in an aquarium, it will shatter even the thickest glass with one ram of its horn and make its escape."
Kangaskhan,"If you come across a young Kangaskhan playing by itself, you must never disturb it or attempt to catch it. The baby Pokémon’s parent is sure to be in the area, and it will become violently enraged at you."
Horsea,"If Horsea senses danger, it will reflexively spray a dense black ink from its mouth and try to escape. This Pokémon swims by cleverly flapping the fin on its back."
Rhydon,"Rhydon has a horn that serves as a drill. It is used for destroying rocks and boulders. This Pokémon occasionally rams into streams of magma, but the armor-like hide prevents it from feeling the heat."
Weezing,"Weezing alternately shrinks and inflates its twin bodies to mix together toxic gases inside. The more the gases are mixed, the more powerful the toxins become. The Pokémon also becomes more putrid."
Koffing,"Koffing embodies toxic substances. It mixes the toxins with raw garbage to set off a chemical reaction that results in a terribly powerful poison gas. The higher the temperature, the more gas is concocted by this Pokémon."
Hitmonchan,Hitmonchan is said to possess the spirit of a boxer who had been working toward a world championship. This Pokémon has an indomitable spirit and will never give up in the face of adversity.
Marowak,Marowak is the evolved form of a Cubone that has overcome its sadness at the loss of its mother and grown tough. This Pokémon’s tempered and hardened spirit is not easily broken.
Cubone,"Cubone pines for the mother it will never see again. Seeing a likeness of its mother in the full moon, it cries. The stains on the skull the Pokémon wears are made by the tears it sheds."
Exeggcute,"This Pokémon consists of six eggs that form a closely knit cluster. The six eggs attract each other and spin around. When cracks increasingly appear on the eggs, Exeggcute is close to evolution."
Electrode,One of Electrode’s characteristics is its attraction to electricity. It is a problematical Pokémon that congregates mostly at electrical power plants to feed on electricity that has just been generated.
Kingler,"Kingler has an enormous, oversized claw. It waves this huge claw in the air to communicate with others. However, because the claw is so heavy, the Pokémon quickly tires."
Hypno,"Hypno holds a pendulum in its hand. The arcing movement and glitter of the pendulum lull the foe into a deep state of hypnosis. While this Pokémon searches for prey, it polishes the pendulum."
Krabby,"Krabby live on beaches, burrowed inside holes dug into the sand. On sandy beaches with little in the way of food, these Pokémon can be seen squabbling with each other over territory."
Drowzee,"If your nose becomes itchy while you are sleeping, it’s a sure sign that one of these Pokémon is standing above your pillow and trying to eat your dream through your nostrils."
Onix,"Onix has a magnet in its brain. It acts as a compass so that this Pokémon does not lose direction while it is tunneling. As it grows older, its body becomes increasingly rounder and smoother."
Haunter,"Haunter is a dangerous Pokémon. If one beckons you while floating in darkness, you must never approach it. This Pokémon will try to lick you with its tongue and steal your life away."
Gastly,"Gastly is largely composed of gaseous matter. When exposed to a strong wind, the gaseous body quickly dwindles away. Groups of this Pokémon cluster under the eaves of houses to escape the ravages of wind."
Cloyster,"Cloyster is capable of swimming in the sea. It does so by swallowing water, then jetting it out toward the rear. This Pokémon shoots spikes from its shell using the same system."
Shellder,"At night, this Pokémon uses its broad tongue to burrow a hole in the seafloor sand and then sleep in it. While it is sleeping, Shellder closes its shell, but leaves its tongue hanging out."
Muk,"This Pokémon’s favorite food is anything that is repugnantly filthy. In dirty towns where people think nothing of throwing away litter on the streets, Muk are certain to gather."
Dewgong,Dewgong loves to snooze on bitterly cold ice. The sight of this Pokémon sleeping on a glacier was mistakenly thought to be a mermaid by a mariner long ago.
Grimer,Grimer emerged from the sludge that settled on a polluted seabed. This Pokémon loves anything filthy. It constantly leaks a horribly germ-infested fluid from all over its body.
Doduo,"Doduo’s two heads contain completely identical brains. A scientific study reported that on rare occasions, there will be examples of this Pokémon possessing different sets of brains."
Magneton,"Magneton emits a powerful magnetic force that is fatal to electronics and precision instruments. Because of this, it is said that some towns warn people to keep this Pokémon inside a Poké Ball."
Farfetchd,"Farfetch’d is always seen with a stalk from a plant of some sort. Apparently, there are good stalks and bad stalks. This Pokémon has been known to fight with others over stalks."
Magnemite,Magnemite floats in the air by emitting electromagnetic waves from the units at its sides. These waves block gravity. This Pokémon becomes incapable of flight if its internal electrical supply is depleted.
Rapidash,"Rapidash usually can be seen casually cantering in the fields and plains. However, when this Pokémon turns serious, its fiery manes flare and blaze as it gallops its way up to 150 mph."
Slowpoke,"Slowpoke uses its tail to catch prey by dipping it in water at the side of a river. However, this Pokémon often forgets what it’s doing and often spends entire days just loafing at water’s edge."
Ponyta,Ponyta is very weak at birth. It can barely stand up. This Pokémon becomes stronger by stumbling and falling to keep up with its parent.
Golem,"Golem is known for rolling down from mountains. To prevent them from rolling into the homes of people downhill, grooves have been dug into the sides of mountains to serve as guideways for diverting this Pokémon’s course."
Graveler,"Rocks are Graveler’s favorite food. This Pokémon will climb a mountain from the base to the summit, crunchingly feasting on rocks all the while. Upon reaching the peak, it rolls back down to the bottom."
Geodude,"When Geodude sleeps deeply, it buries itself halfway into the ground. It will not awaken even if hikers step on it unwittingly. In the morning, this Pokémon rolls downhill in search of food."
Tentacool,Tentacool absorbs sunlight and refracts it using water inside its body to convert it into beam energy. This Pokémon shoots beams from the small round organ above its eyes.
Victreebel,"Victreebel has a long vine that extends from its head. This vine is waved and flicked about as if it were an animal to attract prey. When an unsuspecting prey draws near, this Pokémon swallows it whole."
Weepinbell,"Weepinbell has a large hook on its rear end. At night, the Pokémon hooks on to a tree branch and goes to sleep. If it moves around in its sleep, it may wake up to find itself on the ground."
Bellsprout,"Bellsprout’s thin and flexible body lets it bend and sway to avoid any attack, however strong it may be. From its mouth, this Pokémon spits a corrosive fluid that melts even iron."
Machamp,"Machamp is known as the Pokémon that has mastered every kind of martial arts. If it grabs hold of the foe with its four arms, the battle is all but over. The hapless foe is thrown far over the horizon."
Machoke,"Machoke undertakes bodybuilding every day even as it helps people with tough, physically demanding labor. On its days off, this Pokémon heads to the fields and mountains to exercise and train."
Alakazam,"Alakazam’s brain continually grows, infinitely multiplying brain cells. This amazing brain gives this Pokémon an astoundingly high IQ of 5,000. It has a thorough memory of everything that has occurred in the world."
Kadabra,"Kadabra holds a silver spoon in its hand. The spoon is used to amplify the alpha waves in its brain. Without the spoon, the Pokémon is said to be limited to half the usual amount of its telekinetic powers."
Abra,"Abra needs to sleep for eighteen hours a day. If it doesn’t, this Pokémon loses its ability to use telekinetic powers. If it is attacked, Abra escapes using Teleport while it is still sleeping."
Poliwrath,"Poliwrath’s highly developed, brawny muscles never grow fatigued, however much it exercises. It is so tirelessly strong, this Pokémon can swim back and forth across the ocean without effort."
Poliwag,"Poliwag has a very thin skin. It is possible to see the Pokémon’s spiral innards right through the skin. Despite its thinness, however, the skin is also very flexible. Even sharp fangs bounce right off it."
Arcanine,"Arcanine is known for its high speed. It is said to be capable of running over 6,200 miles in a single day and night. The fire that blazes wildly within this Pokémon’s body is its source of power."
Growlithe,"Growlithe has a superb sense of smell. Once it smells anything, this Pokémon won’t forget the scent, no matter what. It uses its advanced olfactory sense to determine the emotions of other living things."
Golduck,"Golduck is the fastest swimmer among all Pokémon. It swims effortlessly, even in a rough, stormy sea. It sometimes rescues people from wrecked ships floundering in high seas."
Meowth,"Meowth withdraws its sharp claws into its paws to slinkily sneak about without making any incriminating footsteps. For some reason, this Pokémon loves shiny coins that glitter with light."
Persian,Persian has six bold whiskers that give it a look of toughness. The whiskers sense air movements to determine what is in the Pokémon’s surrounding vicinity. It becomes docile if grabbed by the whiskers.
Diglett,"Diglett are raised in most farms. The reason is simple— wherever this Pokémon burrows, the soil is left perfectly tilled for planting crops. This soil is made ideal for growing delicious vegetables."
Venomoth,"Venomoth is nocturnal—it is a Pokémon that only becomes active at night. Its favorite prey are small insects that gather around streetlights, attracted by the light in the darkness."
Paras,Paras has parasitic mushrooms growing on its back called tochukaso. They grow large by drawing nutrients from this Bug Pokémon host. They are highly valued as a medicine for extending life.
Vileplume,"Vileplume has the world’s largest petals. They are used to attract prey that are then doused with toxic spores. Once the prey are immobilized, this Pokémon catches and devours them."
Oddish,"Oddish searches for fertile, nutrient-rich soil, then plants itself. During the daytime, while it is planted, this Pokémon’s feet are thought to change shape and become similar to the roots of trees."
Golbat,"Golbat bites down on prey with its four fangs and drinks the victim’s blood. It becomes active on inky dark moonless nights, flying around to attack people and Pokémon."
Wigglytuff,"Wigglytuff’s body is very flexible. By inhaling deeply, this Pokémon can inflate itself seemingly without end. Once inflated, Wigglytuff bounces along lightly like a balloon."
Jigglypuff,"When this Pokémon sings, it never pauses to breathe. If it is in a battle against an opponent that does not easily fall asleep, Jigglypuff cannot breathe, endangering its life."
Ninetales,Legend has it that Ninetales came into being when nine wizards possessing sacred powers merged into one. This Pokémon is highly intelligent—it can understand human speech.
Vulpix,"Inside Vulpix’s body burns a flame that never goes out. During the daytime, when the temperatures rise, this Pokémon releases flames from its mouth to prevent its body from growing too hot."
Clefairy,"On every night of a full moon, groups of this Pokémon come out to play. When dawn arrives, the tired Clefairy return to their quiet mountain retreats and go to sleep nestled up against each other."
Nidoking,"Nidoking’s thick tail packs enormously destructive power. With one swing, it can topple a metal transmission tower. Once this Pokémon goes on a rampage, there is no stopping it."
