Pokemon,Description
Marshadow,"It sinks into the shadows of people and Pokémon, where it can understand their feelings and copy their capabilities."
Nihilego,"One of the Ultra Beasts. It’s unclear whether or not this Pokémon is sentient, but sometimes it can be observed behaving like a young girl."
Solgaleo,"This Pokémon is said to be a male evolution of Cosmog. At the activation of its third eye, it departs for another world."
Lunala,"Said to live in another world, this Pokémon devours light, drawing the moonless dark veil of night over the brightness of day."
Tapu-bulu,The guardian deity of Ula’ula is a lazy Pokémon. It commands plants to immobilize its foes and then deals them a savage blow with its horns.
Drampa,This Pokémon is friendly to people and loves children most of all. It comes from deep in the mountains to play with children it likes in town.
Pyukumuku,These Pokémon line the beaches. The sticky mucous that covers their bodies can be used to soothe sunburned skin. How convenient!
Comfey,"Baths prepared with the flowers from its vine have a relaxing effect, so this Pokémon is a hit with many people."
Oranguru,"Deep in the jungle, high in the lofty canopy, this Pokémon abides. On rare occasions, it shows up at the beach to match wits with Slowking."
Tsareena,"A Pokémon known for the beauty of its well-shaped legs, it sometimes appears as a mascot in advertisements for beauty salons."
Steenee,This Pokémon is always bouncing around energetically. Other Pokémon are attracted by its lively appearance and pleasant aroma.
Bewear,This Pokémon has the habit of hugging its companions. Many Trainers have left this world after their spines were squashed by its hug.
Stufful,A touch from anyone except a known friend sends it into a surging frenzy. It’s an incredibly dangerous Pokémon.
Salandit,"Volcanoes or dry, craggy places are its home. It emanates a sweet-smelling poisonous gas that attracts bug Pokémon, then attacks them."
Shiinotic,"It emits flickering spores that cause drowsiness. When its prey succumb to sleep, this Pokémon feeds on them by sucking in their energy."
Araquanid,"Despite what its appearance suggests, it cares for others. If it finds vulnerable, weak Pokémon, it protectively brings them into its water bubble."
Dewpider,"When it comes across enemies or potential prey, this Pokémon smashes its water-bubble-covered head into them."
Rockruff,This Pokémon has lived with people since times long ago. It can sense when its Trainer is in the dumps and will stick close by its Trainer’s side.
Mareanie,It’s found crawling on beaches and seafloors. The coral that grows on Corsola’s head is as good as a five-star banquet to this Pokémon.
Vikavolt,It produces electricity via an electrical organ in its abdomen. It overwhelms bird Pokémon with shocking beams of electrical energy.
Grubbin,They often gather near places frequented by electric Pokémon in order to avoid being attacked by bird Pokémon.
Gumshoos,"It adores having Rattata and Raticate for dinner, but as it’s diurnal, it never encounters them. This Pokémon boasts incredible patience."
Pikipek,"This Pokémon feeds on berries, whose leftover seeds become the ammunition for the attacks it fires off from its mouth."
Primarina,Its singing voice is its chief weapon in battle. This Pokémon’s Trainer must prioritize the daily maintenance of its throat at all costs.
Popplio,This Pokémon can control water bubbles. It practices diligently so it can learn to make big bubbles.
Trevenant,"Using its roots as a nervous system, it controls the trees in the forest. It’s kind to the Pokémon that reside in its body."
Amaura,This calm Pokémon lived in a cold land where there were no violent predators like Tyrantrum.
Tyrantrum,"Nothing could stop this Pokémon 100 million years ago, so it behaved like a king."
Furfrou,"Historically, in the Kalos region, these Pokémon were the designated guardians of the king."
Litleo,They set off on their own from their pride and live by themselves to become stronger. These hot-blooded Pokémon are quick to fight.
Vivillon,The patterns on this Pokémon’s wings depend on the climate and topography of its habitat. It scatters colorful scales.
Spewpa,"The beaks of bird Pokémon can’t begin to scratch its stalwart body. To defend itself, it spews powder."
Genesect,This Pokémon existed 300 million years ago. Team Plasma altered it and attached a cannon to its back.
Virizion,Legends say this Pokémon confounded opponents with its swift movements.
Terrakion,"Spoken of in legend, this Pokémon used its phenomenal power to destroy a castle in its effort to protect Pokémon."
Cobalion,It has a body and heart of steel. It worked with its allies to punish people when they hurt Pokémon.
Hydreigon,"It responds to movement by attacking. This scary, three-headed Pokémon devours everything in its path!"
Mandibuzz,"Watching from the sky, they swoop to strike weakened Pokémon on the ground. They decorate themselves with bones."
Golett,Ancient science fashioned this Pokémon from clay. It’s been active for thousands of years.
Haxorus,Their sturdy tusks will stay sharp even if used to cut steel beams. These Pokémon are covered in hard armor.
Litwick,"Litwick shines a light that absorbs the life energy of people and Pokémon, which becomes the fuel that it burns."
Eelektrik,"These Pokémon have a big appetite. When they spot their prey, they attack it and paralyze it with electricity."
Joltik,"They attach themselves to large-bodied Pokémon and absorb static electricity, which they store in an electric pouch."
Alomomola,It gently holds injured and weak Pokémon in its fins. Its special membrane heals their wounds.
Foongus,"It lures Pokémon with its pattern that looks just like a Poké Ball, then releases poison spores."
Escavalier,These Pokémon evolve by wearing the shell covering of a Shelmet. The steel armor protects their whole body.
Deerling,The turning of the seasons changes the color and scent of this Pokémon’s fur. People use it to mark the seasons.
Vanillish,"Snowy mountains are this Pokémon’s habitat. During an ancient ice age, they moved to southern areas."
Vanillite,This Pokémon formed from icicles bathed in energy from the morning sun. It sleeps buried in snow.
Gothita,"They intently observe both Trainers and Pokémon. Apparently, they are looking at something that only Gothita can see."
Minccino,"These Pokémon prefer a tidy habitat. They are always sweeping and dusting, using their tails as brooms."
Zorua,"To protect themselves from danger, they hide their true identities by transforming into people and Pokémon."
Archen,"Said to be an ancestor of bird Pokémon, they were unable to fly and moved about by hopping from one branch to another."
Tirtouga,"Restored from a fossil, this Pokémon can dive to depths beyond half a mile."
Lilligant,Even veteran Trainers face a challenge in getting its beautiful flower to bloom. This Pokémon is popular with celebrities.
Venipede,"Its bite injects a potent poison, enough to paralyze large bird Pokémon that try to prey on it."
Sewaddle,"Since this Pokémon makes its own clothes out of leaves, it is a popular mascot for fashion designers."
Gurdurr,This Pokémon is so muscular and strongly built that even a group of wrestlers could not make it budge an inch.
Pidove,These Pokémon live in cities. They are accustomed to people. Flocks often gather in parks and plazas.
Munna,"It eats the dreams of people and Pokémon. When it eats a pleasant dream, it expels pink-colored mist."
Pansear,This Pokémon lives in caves in volcanoes. The fire within the tuft on its head can reach 600 degrees Fahrenheit.
Lillipup,"Though it is a very brave Pokémon, it’s also smart enough to check its foe’s strength and avoid battle."
Arceus,It is told in mythology that this Pokémon was born before the universe even existed.
Manaphy,It starts its life with a wondrous power that permits it to bond with any kind of Pokémon.
Regigigas,There is an enduring legend that states this Pokémon towed continents with ropes.
Yanmega,This six-legged Pokémon is easily capable of transporting an adult in flight. The wings on its tail help it stay balanced.
Mime-jr,"It habitually mimics foes. Once mimicked, the foe cannot take its eyes off this Pokémon."
Drifloon,These Pokémon are called the “Signpost for Wandering Spirits.” Children holding them sometimes vanish.
Bastiodon,Any frontal attack is repulsed. It is a docile Pokémon that feeds on grass and berries.
Starly,"They flock around mountains and fields, chasing after bug Pokémon. Their singing is noisy and annoying."
Torterra,Small Pokémon occasionally gather on its unmoving back to begin building their nests.
Grotle,It knows where pure water wells up. It carries fellow Pokémon there on its back.
Latios,Latios will only open its heart to a Trainer with a compassionate spirit. This Pokémon can fly faster than a jet plane by folding its forelegs to minimize air resistance.
Latias,Latias is highly intelligent and capable of understanding human speech. It is covered with a glass-like down. The Pokémon enfolds its body with its down and refracts light to alter its appearance.
Regice,"Regice cloaks itself with frigid air of -328 degrees Fahrenheit. Things will freeze solid just by going near this Pokémon. Its icy body is so cold, it will not melt even if it is immersed in magma."
Metagross,"Metagross is the result of two Metang achieving fusion. When hunting, this Pokémon pins the prey to the ground under its massive body. It then eats the helpless victim using the large mouth on its stomach."
Metang,"When two Beldum fuse together, Metang is formed. The brains of the Beldum are joined by a magnetic nervous system. This Pokémon turns its arms to the rear for traveling at high speed."
Beldum,"Beldum keeps itself floating by generating a magnetic force that repels earth’s natural magnetism. When it sleeps, this Pokémon anchors itself to a cliff using the hooks on its rear."
Salamence,"By evolving into Salamence, this Pokémon finally realizes its long-held dream of growing wings. To express its joy, it flies and wheels all over the sky while spouting flames from its mouth."
Shelgon,"Covering Shelgon’s body are outgrowths much like bones. The shell is very hard and bounces off enemy attacks. When awaiting evolution, this Pokémon hides away in a cavern."
Bagon,"Bagon harbors a never-ending dream of one day soaring high among the clouds. As if trying to dispel its frustration over its inability to fly, this Pokémon slams its hard head against huge rocks and shatters them into pebbles."
Luvdisc,Luvdisc’s heart-shaped body is a symbol of love and romance. It is said that any couple meeting this Pokémon is promised a loving relationship that never ends.
Relicanth,Relicanth is a rare species that was discovered in deep-sea explorations. This Pokémon’s body withstands the enormous water pressure of the ocean depths. Its body is covered in tough scales that are like craggy rocks.
Gorebyss,"Although Gorebyss is the very picture of elegance and beauty while swimming, it is also cruel. When it spots prey, this Pokémon inserts its thin mouth into the prey’s body and drains the prey of its body fluids."
Clamperl,"Clamperl grows while being protected by its rock-hard shell. When its body becomes too large to fit inside the shell, it is sure evidence that this Pokémon is getting close to evolution."
Huntail,"Huntail’s tail is shaped like a fish. It uses the tail to attract prey, then swallows the prey whole with its large, gaping mouth. This Pokémon swims by wiggling its slender body like a snake."
Sealeo,"Sealeo often balances and rolls things on the tip of its nose. While the Pokémon is rolling something, it checks the object’s aroma and texture to determine whether it likes the object or not."
Spheal,"Spheal always travels by rolling around on its ball-like body. When the season for ice floes arrives, this Pokémon can be seen rolling about on ice and crossing the sea."
Snorunt,Snorunt survives by eating only snow and ice. Old folklore claims that a house visited by this Pokémon is sure to prosper for many generations to come.
Glalie,"Glalie has the ability to freely control ice. For example, it can instantly freeze its prey solid. After immobilizing its prey in ice, this Pokémon enjoys eating it in leisurely fashion."
Wynaut,"Wynaut gather on moonlit nights to play by squeezing up against each other. By being squeezed, this Pokémon gains endurance and is trained to dole out powerful counterattacks."
Absol,"Absol has the ability to foretell the coming of natural disasters. It lives in a harsh, rugged mountain environment. This Pokémon very rarely ventures down from the mountains."
Tropius,Children of the southern tropics eat as snacks the fruit that grows in bunches around the neck of Tropius. This Pokémon flies by flapping the leaves on its back as if they were wings.
Chimecho,"In high winds, Chimecho cries as it hangs from a tree branch or the eaves of a building using a suction cup on its head. This Pokémon plucks berries with its long tail and eats them."
Dusclops,"Dusclops absorbs anything, however large the object may be. This Pokémon hypnotizes its foe by waving its hands in a macabre manner and by bringing its single eye to bear. The hypnotized foe is made to do Dusclops’s bidding."
Banette,"A cursed energy permeated the stuffing of a discarded and forgotten plush doll, giving it new life as Banette. The Pokémon’s energy would escape if it were to ever open its mouth."
Duskull,Duskull wanders lost among the deep darkness of midnight. There is an oft-told admonishment given to misbehaving children that this Pokémon will spirit away bad children who earn scoldings from their mothers.
Castform,"Castform borrows the power of nature to transform itself into the guises of the sun, rain, and snow-clouds. This Pokémon’s feelings change with the weather."
Milotic,"Milotic live at the bottom of large lakes. When this Pokémon’s body glows a vivid pink, it releases a pulsing wave of energy that brings soothing calm to troubled hearts."
Armaldo,"Armaldo is a Pokémon species that became extinct in prehistoric times. This Pokémon is said to have walked on its hind legs, which would have been more convenient for life on land."
Feebas,"While Feebas’s body is in tatters, it has a hardy and tenacious life force that enables it to live anywhere. However, this Pokémon is also slow and dimwitted, making it an easy catch."
Cradily,"Cradily’s body serves as an anchor, preventing it from being washed away in rough seas. This Pokémon secretes a strong digestive fluid from its tentacles."
Anorith,"Anorith is said to be a type of Pokémon predecessor, with eight wings at the sides of its body. This Pokémon swam in the primordial sea by undulating these eight wings."
Lileep,"Lileep is an ancient Pokémon that was regenerated from a fossil. It remains permanently anchored to a rock. From its immobile perch, this Pokémon intently scans for prey with its two eyes."
Claydol,"Claydol is an enigma that appeared from a clay statue made by an ancient civilization dating back 20,000 years. This Pokémon shoots beams from both its hands."
Baltoy,"As soon as it spots others of its kind, Baltoy congregates with them and then begins crying noisily in unison. This Pokémon sleeps while cleverly balancing itself on its one foot."
Crawdaunt,"Crawdaunt molts (sheds) its shell regularly. Immediately after molting, its shell is soft and tender. Until the shell hardens, this Pokémon hides in its streambed burrow to avoid attack from its foes."
Corphish,Corphish catches prey with its sharp claws. It has no likes or dislikes when it comes to food—it will eat anything. This Pokémon has no trouble living in filthy water.
Whiscash,"If Whiscash goes on a wild rampage, it sets off a quake-like tremor with a radius of over three miles. This Pokémon has the ability to predict real earthquakes."
Solrock,Sunlight is the source of Solrock’s power. It is said to possess the ability to read the emotions of others. This Pokémon gives off intense heat while rotating its body.
Lunatone,"Lunatone becomes active around the time of the full moon. Instead of walking, it moves by floating in midair. The Pokémon’s intimidating red eyes cause all those who see it to become transfixed with fear."
Seviper,Seviper’s swordlike tail serves two purposes—it slashes foes and douses them with secreted poison. This Pokémon will not give up its long-running blood feud with Zangoose.
Altaria,Altaria sings in a gorgeous soprano. Its wings are like cotton clouds. This Pokémon catches updrafts with its buoyant wings and soars way up into the wild blue yonder.
Cacturne,"If a traveler is going through a desert in the thick of night, Cacturne will follow in a ragtag group. The Pokémon are biding their time, waiting for the traveler to tire and become incapable of moving."
Swablu,"Swablu loves to make things clean. If it spots something dirty, it will wipe and polish it with its cottony wings. If its wings become dirty, this Pokémon finds a stream and showers itself."
Cacnea,"The more arid and harsh the environment, the more pretty and fragrant a flower Cacnea grows. This Pokémon battles by wildly swinging its thorny arms."
Flygon,"Flygon whips up a sandstorm by flapping its wings. The wings create a series of notes that sound like singing. Because the “singing” is the only thing that can be heard in a sandstorm, this Pokémon is said to be the desert spirit."
Spinda,No two Spinda are said to have identical spot patterns on their hides. This Pokémon moves in a curious manner as if it is stumbling in dizziness. Its lurching movements can cause the opponent to become confused.
Trapinch,Trapinch is a patient hunter. It digs an inescapable pit in a desert and waits for its prey to come tumbling down. This Pokémon can go a whole week without access to any water.
Grumpig,"Grumpig uses the black pearls on its body to wield its fantastic powers. When it is doing so, it dances bizarrely. This Pokémon’s black pearls are valuable as works of art."
Spoink,Spoink keeps a pearl on top of its head. The pearl functions to amplify this Pokémon’s psychokinetic powers. It is therefore on a constant search for a bigger pearl.
Camerupt,The humps on Camerupt’s back are formed by a transformation of its bones. They sometimes blast out molten magma. This Pokémon apparently erupts often when it is enraged.
Torkoal,"Torkoal generates energy by burning coal. It grows weaker as the fire dies down. When it is preparing for battle, this Pokémon burns more coal."
Numel,"Numel stores magma of almost 2,200 degrees Fahrenheit within its body. If it gets wet, the magma cools and hardens. In that event, the Pokémon’s body grows heavy and its movements become sluggish."
Wailmer,"Wailmer can store water inside its body to transform itself into a ball for bouncing around on the ground. By filling itself up with more water, this Pokémon can elevate the height of its bounces."
Wailord,"When chasing prey, Wailord herds them by leaping out of the water and making a humongous splash. It is breathtaking to see this Pokémon leaping out of the sea with others in its pod."
Sharpedo,Sharpedo can swim at speeds of up to 75 mph by jetting seawater out of its backside. This Pokémon’s drawback is its inability to swim long distances.
Carvanha,"If anything invades Carvanha’s territory, it will swarm and tear at the intruder with its pointed fangs. On its own, however, this Pokémon turns suddenly timid."
Swalot,"Swalot has no teeth, so what it eats, it swallows whole, no matter what. Its cavernous mouth yawns widely. An automobile tire could easily fit inside this Pokémon’s mouth."
Gulpin,Most of Gulpin’s body is made up of its stomach—its heart and brain are very small in comparison. This Pokémon’s stomach contains special enzymes that dissolve anything.
Illumise,Illumise leads a flight of illuminated Volbeat to draw signs in the night sky. This Pokémon is said to earn greater respect from its peers by composing more complex designs in the sky.
Roselia,"On extremely rare occasions, a Roselia is said to appear with its flowers in unusual colors. The thorns on this Pokémon’s head contain a vicious poison."
Volbeat,"Volbeat’s tail glows like a lightbulb. With other Volbeat, it uses its tail to draw geometric shapes in the night sky. This Pokémon loves the sweet aroma given off by Illumise."
Minun,"Minun loves to cheer on its partner in battle. It gives off sparks from its body while it is doing so. If its partner is in trouble, this Pokémon gives off increasing amounts of sparks."
Plusle,"When Plusle is cheering on its partner, it flashes with electric sparks from all over its body. If its partner loses, this Pokémon cries loudly."
Manectric,Manectric discharges strong electricity from its mane. The mane is used for collecting electricity in the atmosphere. This Pokémon creates thunderclouds above its head.
Medicham,"Through the power of meditation, Medicham developed its sixth sense. It gained the ability to use psychokinetic powers. This Pokémon is known to meditate for a whole month without eating."
Electrike,"Electrike runs faster than the human eye can follow. The friction from running is converted into electricity, which is then stored in this Pokémon’s fur."
Meditite,Meditite heightens its inner energy through meditation. It survives on just one berry a day. Minimal eating is another aspect of this Pokémon’s training.
Aggron,"Aggron is protective of its environment. If its mountain is ravaged by a landslide or a fire, this Pokémon will haul topsoil to the area, plant trees, and beautifully restore its own territory."
Lairon,"Lairon feeds on iron contained in rocks and water. It makes its nest on mountains where iron ore is buried. As a result, the Pokémon often clashes with humans mining the iron ore."
Aron,"Aron has a body of steel. With one all-out charge, this Pokémon can demolish even a heavy dump truck. The destroyed dump truck then becomes a handy meal for the Pokémon."
Sableye,Sableye digs the ground with sharpened claws to find rocks that it eats. Substances in the eaten rocks crystallize and rise up to the Pokémon’s body surface.
Mawile,"Don’t be taken in by this Pokémon’s cute face—it’s very dangerous. Mawile fools the foe into letting down its guard, then chomps down with its massive jaws. The steel jaws are really horns that have been transformed."
Delcatty,"Delcatty sleeps anywhere it wants without keeping a permanent nest. If other Pokémon approach it as it sleeps, this Pokémon will never fight—it will just move away somewhere else."
Skitty,"Skitty is known to chase around playfully after its own tail. In the wild, this Pokémon lives in holes in the trees of forests. It is very popular as a pet because of its adorable looks."
Nosepass,"Nosepass had been said to be completely unmoving, with its magnetic nose pointed due north. However, close observation has revealed that the Pokémon actually moves by a little over 3/8 of an inch every year."
Azurill,"Azurill’s tail is large and bouncy. It is packed full of the nutrients this Pokémon needs to grow. Azurill can be seen bouncing and playing on its big, rubbery tail."
Makuhita,"Makuhita has a tireless spirit—it will never give up hope. It eats a lot of food, gets plenty of sleep, and it trains very rigorously. By living that way, this Pokémon packs its body with energy."
Hariyama,"Hariyama’s thick body may appear fat, but it is actually a hunk of solid muscle. If this Pokémon bears down and tightens all its muscles, its body becomes as hard as a rock."
Exploud,Exploud communicates its feelings to the others by emitting whistle-like sounds from the tubes on its body. This Pokémon only raises its voice when it is in battle.
Loudred,"Loudred shouts while stamping its feet. After it finishes shouting, this Pokémon becomes incapable of hearing anything for a while. This is considered to be a weak point."
Whismur,"Whismur is very timid. If it starts to cry loudly, it becomes startled by its own crying and cries even harder. When it finally stops crying, the Pokémon goes to sleep, all tired out."
Shedinja,Shedinja is a peculiar Pokémon. It seems to appear unsought in a Poké Ball after a Nincada evolves. This bizarre Pokémon is entirely immobile—it doesn’t even breathe.
Nincada,Nincada lives underground. It uses its sharp claws to carve the roots of trees and absorb moisture and nutrients. This Pokémon can’t withstand bright sunlight so avoids it.
Ninjask,"If Ninjask is not trained properly, it will refuse to obey the Trainer and cry loudly continuously. Because of this quality, this Pokémon is said to be one that puts the Trainer’s abilities to the test."
Slaking,"Wherever Slaking live, rings of over a yard in diameter appear in grassy fields. They are made by the Pokémon as it eats all the grass within reach while lying prone on the ground."
Vigoroth,"Vigoroth is simply incapable of remaining still. Even when it tries to sleep, the blood in its veins grows agitated, compelling this Pokémon to run wild throughout the jungle before it can settle down."
Breloom,The seeds ringing Breloom’s tail are made of hardened toxic spores. It is horrible to eat the seeds. Just taking a bite of this Pokémon’s seed will cause your stomach to rumble.
Slakoth,"Slakoth’s heart beats just once a minute. Whatever happens, it is content to loaf around motionless. It is rare to see this Pokémon in motion."
