Pokemon,Description
Shroomish,"If Shroomish senses danger, it shakes its body and scatters spores from the top of its head. This Pokémon’s spores are so toxic, they make trees and weeds wilt."
Surskit,"If Surskit senses danger, it secretes a thick, sugary syrup from the tip of its head. There are some Pokémon that love eating this syrup."
Gardevoir,Gardevoir has the psychokinetic power to distort the dimensions and create a small black hole. This Pokémon will try to protect its Trainer even at the risk of its own life.
Kirlia,"Kirlia uses the horns on its head to amplify its psychokinetic power. When the Pokémon uses its power, the air around it becomes distorted, creating mirages of nonexistent scenery."
Ralts,"Ralts has the ability to sense the emotions of people. If its Trainer is in a cheerful mood, this Pokémon grows cheerful and joyous in the same way."
Pelipper,"Pelipper searches for food while in flight by skimming the wave tops. This Pokémon dips its large bill in the sea to scoop up food, then swallows everything in one big gulp."
Wingull,Wingull rides updrafts rising from the sea by extending its long and narrow wings to glide. This Pokémon’s long beak is useful for catching prey.
Taillow,"Taillow is young—it has only just left its nest. As a result, it sometimes becomes lonesome and cries at night. This Pokémon feeds on Wurmple that live in forests."
Shiftry,Shiftry’s large fans generate awesome gusts of wind at a speed close to 100 feet per second. The whipped-up wind blows anything away. This Pokémon chooses to live quietly deep in forests.
Nuzleaf,This Pokémon pulls out the leaf on its head and makes a flute with it. The sound of Nuzleaf’s flute strikes fear and uncertainty in the hearts of people lost in a forest.
Seedot,Seedot looks exactly like an acorn when it is dangling from a tree branch. It startles other Pokémon by suddenly moving. This Pokémon polishes its body once a day using leaves.
Ludicolo,"Upon hearing an upbeat and cheerful rhythm, the cells in Ludicolo’s body become very energetic and active. Even in battle, this Pokémon will exhibit an amazing amount of power."
Lombre,"Lombre’s entire body is covered by a slippery, slimy film. It feels horribly unpleasant to be touched by this Pokémon’s hands. Lombre is often mistaken for a human child."
Dustox,"When Dustox flaps its wings, a fine dust is scattered all over. This dust is actually a powerful poison that will even make a pro wrestler sick. This Pokémon searches for food using its antennae like radar."
Lotad,"Lotad is said to have dwelled on land before. However, this Pokémon is thought to have returned to water because the leaf on its head grew large and heavy. It now lives by floating atop the water."
Cascoon,"If it is attacked, Cascoon remains motionless however badly it may be hurt. It does so because if it were to move, its body would be weak upon evolution. This Pokémon will also not forget the pain it endured."
Silcoon,"Silcoon was thought to endure hunger and not consume anything before its evolution. However, it is now thought that this Pokémon slakes its thirst by drinking rainwater that collects on its silk."
Beautifly,"Beautifly has a long mouth like a coiled needle, which is very convenient for collecting pollen from flowers. This Pokémon rides the spring winds as it flits around gathering pollen."
Wurmple,Wurmple is targeted by Swellow as prey. This Pokémon will try to resist by pointing the spikes on its rear at the attacking predator. It will weaken the foe by leaking poison from the spikes.
Linoone,"When hunting, Linoone will make a beeline straight for the prey at a full run. While this Pokémon is capable of topping 60 mph, it has to come to a screeching halt before it can turn."
Zigzagoon,The hair on Zigzagoon’s back is bristly. It rubs the hard back hair against trees to leave its territorial markings. This Pokémon may play dead to fool foes in battle.
Mightyena,Mightyena travel and act as a pack in the wild. The memory of its life in the wild compels the Pokémon to obey only those Trainers that it recognizes to possess superior skill.
Poochyena,Poochyena is an omnivore—it will eat anything. A distinguishing feature is how large its fangs are compared to its body. This Pokémon tries to intimidate its foes by making the hair on its tail bristle out.
Marshtomp,"Marshtomp is much faster at traveling through mud than it is at swimming. This Pokémon’s hindquarters exhibit obvious development, giving it the ability to walk on just its hind legs."
Mudkip,"In water, Mudkip breathes using the gills on its cheeks. If it is faced with a tight situation in battle, this Pokémon will unleash its amazing power—it can crush rocks bigger than itself."
Blaziken,Blaziken has incredibly strong legs—it can easily clear a 30-story building in one leap. This Pokémon’s blazing punches leave its foes scorched and blackened.
Torchic,Torchic has a place inside its body where it keeps its flame. Give it a hug—it will be glowing with warmth. This Pokémon is covered all over by a fluffy coat of down.
Combusken,Combusken battles with the intensely hot flames it spews from its beak and with outstandingly destructive kicks. This Pokémon’s cry is very loud and distracting.
Sceptile,Sceptile has seeds growing on its back. They are said to be bursting with nutrients that revitalize trees. This Pokémon raises the trees in a forest with loving care.
Grovyle,"This Pokémon adeptly flies from branch to branch in trees. In a forest, no Pokémon can ever hope to catch a fleeing Grovyle however fast they may be."
Celebi,"This Pokémon came from the future by crossing over time. It is thought that so long as Celebi appears, a bright and shining future awaits us."
Treecko,"Treecko is cool, calm, and collected—it never panics under any situation. If a bigger foe were to glare at this Pokémon, it would glare right back without conceding an inch of ground."
Ho-oh,Ho-Oh’s feathers glow in seven colors depending on the angle at which they are struck by light. These feathers are said to bring happiness to the bearers. This Pokémon is said to live at the foot of a rainbow.
Lugia,"Lugia’s wings pack devastating power—a light fluttering of its wings can blow apart regular houses. As a result, this Pokémon chooses to live out of sight deep under the sea."
Tyranitar,"Tyranitar is so overwhelmingly powerful, it can bring down a whole mountain to make its nest. This Pokémon wanders about in mountains seeking new opponents to fight."
Larvitar,"Larvitar is born deep under the ground. To come up to the surface, this Pokémon must eat its way through the soil above. Until it does so, Larvitar cannot see its parents."
Suicune,Suicune embodies the compassion of a pure spring of water. It runs across the land with gracefulness. This Pokémon has the power to purify dirty water.
Raikou,Raikou embodies the speed of lightning. The roars of this Pokémon send shock waves shuddering through the air and shake the ground as if lightning bolts had come crashing down.
Entei,Entei embodies the passion of magma. This Pokémon is thought to have been born in the eruption of a volcano. It sends up massive bursts of fire that utterly consume all that they touch.
Blissey,"Blissey senses sadness with its fluffy coat of fur. If it does so, this Pokémon will rush over to a sad person, no matter how far away, to share a Lucky Egg that brings a smile to any face."
Magby,"Magby’s state of health is determined by observing the fire it breathes. If the Pokémon is spouting yellow flames from its mouth, it is in good health. When it is fatigued, black smoke will be mixed in with the flames."
Elekid,"Elekid stores electricity in its body. If it touches metal and accidentally discharges all its built-up electricity, this Pokémon begins swinging its arms in circles to recharge itself."
Hitmontop,"Hitmontop spins on its head at high speed, all the while delivering kicks. This technique is a remarkable mix of both offense and defense at the same time. The Pokémon travels faster spinning than it does walking."
Tyrogue,"Tyrogue becomes stressed out if it does not get to train every day. When raising this Pokémon, the Trainer must establish and uphold various training methods."
Stantler,"Stantler’s magnificent antlers were traded at high prices as works of art. As a result, this Pokémon was hunted close to extinction by those who were after the priceless antlers."
Smeargle,"Smeargle marks the boundaries of its territory using a body fluid that leaks out from the tip of its tail. Over 5,000 different marks left by this Pokémon have been found."
Donphan,"If Donphan were to tackle with its hard body, even a house could be destroyed. Using its massive strength, the Pokémon helps clear rock and mud slides that block mountain trails."
Porygon2,Porygon2 was created by humans using the power of science. The man-made Pokémon has been endowed with artificial intelligence that enables it to learn new gestures and emotions on its own.
Phanpy,"Phanpy uses its long nose to shower itself. When others gather around, they thoroughly douse each other with water. These Pokémon can be seen drying their soaking-wet bodies at the edge of water."
Kingdra,"Kingdra sleeps on the seafloor where it is otherwise devoid of life. When a storm arrives, the Pokémon is said to awaken and wander about in search of prey."
Houndoom,"In a Houndoom pack, the one with its horns raked sharply toward the back serves a leadership role. These Pokémon choose their leader by fighting among themselves."
Houndour,Houndour hunt as a coordinated pack. They communicate with each other using a variety of cries to corner their prey. This Pokémon’s remarkable teamwork is unparalleled.
Mantine,"On sunny days, schools of Mantine can be seen elegantly leaping over the sea’s waves. This Pokémon is not bothered by the Remoraid that hitches rides."
Delibird,"Delibird carries its food bundled up in its tail. There once was a famous explorer who managed to reach the peak of the world’s highest mountain, thanks to one of these Pokémon sharing its food."
Remoraid,"Remoraid sucks in water, then expels it at high velocity using its abdominal muscles to shoot down flying prey. When evolution draws near, this Pokémon travels downstream from rivers."
Octillery,"Octillery grabs onto its foe using its tentacles. This Pokémon tries to immobilize it before delivering the finishing blow. If the foe turns out to be too strong, Octillery spews ink to escape."
Corsola,"Clusters of Corsola congregate in warm seas where they serve as ideal hiding places for smaller Pokémon. When the water temperature falls, this Pokémon migrates to the southern seas."
Piloswine,Piloswine is covered by a thick coat of long hair that enables it to endure the freezing cold. This Pokémon uses its tusks to dig up food that has been buried under ice.
Magcargo,"Magcargo’s body temperature is approximately 18,000 degrees Fahrenheit. Water is vaporized on contact. If this Pokémon is caught in the rain, the raindrops instantly turn into steam, cloaking the area in a thick fog."
Swinub,Swinub roots for food by rubbing its snout against the ground. Its favorite food is a mushroom that grows under the cover of dead grass. This Pokémon occasionally roots out hot springs.
Ursaring,"In the forests inhabited by Ursaring, it is said that there are many streams and towering trees where they gather food. This Pokémon walks through its forest gathering food every day."
Sneasel,Sneasel scales trees by punching its hooked claws into the bark. This Pokémon seeks out unguarded nests and steals eggs for food while the parents are away.
Teddiursa,This Pokémon likes to lick its palms that are sweetened by being soaked in honey. Teddiursa concocts its own honey by blending fruits and pollen collected by Beedrill.
Heracross,"Heracross has sharp claws on its feet. These are planted firmly into the ground or the bark of a tree, giving the Pokémon a secure and solid footing to forcefully fling away foes with its proud horn."
Scizor,Scizor has a body with the hardness of steel. It is not easily fazed by ordinary sorts of attacks. This Pokémon flaps its wings to regulate its body temperature.
Qwilfish,"Qwilfish sucks in water, inflating itself. This Pokémon uses the pressure of the water it swallowed to shoot toxic quills all at once from all over its body. It finds swimming somewhat challenging."
Granbull,"Granbull has a particularly well-developed lower jaw. The enormous fangs are heavy, causing the Pokémon to tip its head back for balance. Unless it is startled, it will not try to bite indiscriminately."
Snubbull,"By baring its fangs and making a scary face, Snubbull sends smaller Pokémon scurrying away in terror. However, this Pokémon seems a little sad at making its foes flee."
Gligar,"Gligar glides through the air without a sound as if it were sliding. This Pokémon hangs on to the face of its foe using its clawed hind legs and the large pincers on its forelegs, then injects the prey with its poison barb."
Steelix,Steelix lives even further underground than Onix. This Pokémon is known to dig toward the earth’s core. There are records of this Pokémon reaching a depth of over six-tenths of a mile underground.
Wobbuffet,"Wobbuffet does nothing but endure attacks—it won’t attack on its own. However, it won’t endure an attack on its tail. When that happens, the Pokémon will try to take the foe with it using Destiny Bond."
Unown,"This Pokémon is shaped like ancient writing. It is a mystery as to which came first, the ancient writings or the various Unown. Research into this topic is ongoing but nothing is known."
Misdreavus,"Misdreavus frightens people with a creepy, sobbing cry. The Pokémon apparently uses its red spheres to absorb the fearful feelings of foes and turn them into nutrition."
Murkrow,Murkrow was feared and loathed as the alleged bearer of ill fortune. This Pokémon shows strong interest in anything that sparkles or glitters. It will even try to steal rings from women.
Slowking,"Slowking undertakes research every day in an effort to solve the mysteries of the world. However, this Pokémon apparently forgets everything it has learned if the Shellder on its head comes off."
Espeon,Espeon is extremely loyal to any Trainer it considers to be worthy. It is said that this Pokémon developed its precognitive powers to protect its Trainer from harm.
Quagsire,"Quagsire hunts for food by leaving its mouth wide open in water and waiting for its prey to blunder in unaware. Because the Pokémon does not move, it does not get very hungry."
Yanma,Yanma is capable of seeing 360 degrees without having to move its eyes. It is a great flier that is adept at making sudden stops and turning midair. This Pokémon uses its flying ability to quickly chase down targeted prey.
Aipom,"Aipom’s tail ends in a hand-like appendage that can be cleverly manipulated. However, because the Pokémon uses its tail so much, its real hands have become rather clumsy."
Jumpluff,Jumpluff rides warm southern winds to cross the sea and fly to foreign lands. The Pokémon descends to the ground when it encounters cold air while it is floating.
Hoppip,"This Pokémon drifts and floats with the wind. If it senses the approach of strong winds, Hoppip links its leaves with other Hoppip to prepare against being blown away."
Skiploom,"Skiploom’s flower blossoms when the temperature rises above 64 degrees Fahrenheit. How much the flower opens depends on the temperature. For that reason, this Pokémon is sometimes used as a thermometer."
Politoed,"The curled hair on Politoed’s head is proof of its status as a king. It is said that the longer and more curled the hair, the more respect this Pokémon earns from its peers."
Sudowoodo,"Sudowoodo camouflages itself as a tree to avoid being attacked by enemies. However, because its hands remain green throughout the year, the Pokémon is easily identified as a fake during the winter."
Marill,"When fishing for food at the edge of a fast-running stream, Marill wraps its tail around the trunk of a tree. This Pokémon’s tail is flexible and configured to stretch."
Azumarill,Azumarill can make balloons out of air. It makes these air balloons if it spots a drowning Pokémon. The air balloons enable the Pokémon in trouble to breathe.
Bellossom,"A Bellossom grows flowers more beautifully if it has evolved from a smelly Gloom—the more stinky the better. At night, this Pokémon closes its petals and goes to sleep."
Ampharos,Ampharos gives off so much light that it can be seen even from space. People in the old days used the light of this Pokémon to send signals back and forth with others far away.
Xatu,Xatu is known to stand motionless while staring at the sun all day long. Some people revere it as a mystical Pokémon out of their belief that Xatu is in possession of the power to see into the future.
Natu,Natu has a highly developed jumping ability. The Pokémon flaps and leaps onto tree branches that are taller than grown-up people to pick at the tree’s new shoots.
Togepi,"As its energy, Togepi uses the positive emotions of compassion and pleasure exuded by people and Pokémon. This Pokémon stores up feelings of happiness inside its shell, then shares them with others."
Togetic,"Togetic is said to be a Pokémon that brings good fortune. When the Pokémon spots someone who is pure of heart, it is said to appear and share its happiness with that person."
Pichu,"When Pichu plays with others, it may short out electricity with another Pichu, creating a shower of sparks. In that event, this Pokémon will begin crying, startled by the flash of sparks."
Cleffa,"On nights with many shooting stars, Cleffa can be seen dancing in a ring. They dance through the night and stop only at the break of day, when these Pokémon quench their thirst with the morning dew."
Lanturn,"Lanturn is known to emit light. If you peer down into the dark sea from a ship at night, you can sometimes see this Pokémon’s light rising from the depths where it swims. It gives the sea an appearance of a starlit night."
Chinchou,"Chinchou’s two antennas are filled with cells that generate strong electricity. This Pokémon’s cells create so much electrical power, it even makes itself tingle slightly."
Crobat,Crobat sneaks up on its intended prey using wings that barely make a sound. This Pokémon rests by hanging on a tree branch with its rear legs that serve as wings.
Spinarak,The web spun by Spinarak can be considered its second nervous system. It is said that this Pokémon can determine what kind of prey is touching its web just by the tiny vibrations it feels through the web’s strands.
Ariados,Ariados’s feet are tipped with tiny hooked claws that enable it to scuttle on ceilings and vertical walls. This Pokémon constricts the foe with thin and strong silk webbing.
Ledian,"It is said that in lands with clean air, where the stars fill the sky, there live Ledian in countless numbers. There is a good reason for this—the Pokémon uses the light of the stars as its energy."
Ledyba,Ledyba secretes an aromatic fluid from where its legs join its body. This fluid is used for communicating with others. This Pokémon conveys its feelings to others by altering the fluid’s scent.
Hoothoot,"Hoothoot has an internal organ that senses and tracks the earth’s rotation. Using this special organ, this Pokémon begins hooting at precisely the same time every day."
Noctowl,"Noctowl never fails at catching prey in darkness. This Pokémon owes its success to its superior vision that allows it to see in minimal light, and to its soft, supple wings that make no sound in flight."
Furret,"Furret has a very slim build. When under attack, it can slickly squirm through narrow spaces and get away. In spite of its short limbs, this Pokémon is very nimble and fleet."
Sentret,"When Sentret sleeps, it does so while another stands guard. The sentry wakes the others at the first sign of danger. When this Pokémon becomes separated from its pack, it becomes incapable of sleep due to fear."
Typhlosion,Typhlosion obscures itself behind a shimmering heat haze that it creates using its intensely hot flames. This Pokémon creates blazing explosive blasts that burn everything to cinders.
Totodile,"Despite the smallness of its body, Totodile’s jaws are very powerful. While the Pokémon may think it is just playfully nipping, its bite has enough power to cause serious injury."
Quilava,Quilava keeps its foes at bay with the intensity of its flames and gusts of superheated air. This Pokémon applies its outstanding nimbleness to dodge attacks even while scorching the foe with flames.
Cyndaquil,"Cyndaquil protects itself by flaring up the flames on its back. The flames are vigorous if the Pokémon is angry. However, if it is tired, the flames splutter fitfully with incomplete combustion."
Meganium,"The fragrance of Meganium’s flower soothes and calms emotions. In battle, this Pokémon gives off more of its becalming scent to blunt the foe’s fighting spirit."
Chikorita,"In battle, Chikorita waves its leaf around to keep the foe at bay. However, a sweet fragrance also wafts from the leaf, becalming the battling Pokémon and creating a cozy, friendly atmosphere all around."
Mew,"Mew is said to possess the genetic composition of all Pokémon. It is capable of making itself invisible at will, so it entirely avoids notice even if it approaches people."
Dragonite,Dragonite is capable of circling the globe in just 16 hours. It is a kindhearted Pokémon that leads lost and foundering ships in a storm to the safety of land.
Mewtwo,"Mewtwo is a Pokémon that was created by genetic manipulation. However, even though the scientific power of humans created this Pokémon’s body, they failed to endow Mewtwo with a compassionate heart."
Moltres,"Moltres is a legendary bird Pokémon that has the ability to control fire. If this Pokémon is injured, it is said to dip its body in the molten magma of a volcano to burn and heal itself."
Articuno,"Articuno is a legendary bird Pokémon that can control ice. The flapping of its wings chills the air. As a result, it is said that when this Pokémon flies, snow will fall."
Zapdos,Zapdos is a legendary bird Pokémon that has the ability to control electricity. It usually lives in thunderclouds. The Pokémon gains power if it is stricken by lightning bolts.
Snorlax,Snorlax’s typical day consists of nothing more than eating and sleeping. It is such a docile Pokémon that there are children who use its expansive belly as a place to play.
Kabutops,Kabutops swam underwater to hunt for its prey in ancient times. The Pokémon was apparently evolving from being a water dweller to living on land as evident from the beginnings of change in its gills and legs.
Aerodactyl,Aerodactyl is a Pokémon from the age of dinosaurs. It was regenerated from genetic material extracted from amber. It is imagined to have been the king of the skies in ancient times.
Kabuto,"Kabuto is a Pokémon that has been regenerated from a fossil. However, in extremely rare cases, living examples have been discovered. The Pokémon has not changed at all for 300 million years."
Omanyte,"Omanyte is one of the ancient and long-since-extinct Pokémon that have been regenerated from fossils by people. If attacked by an enemy, it withdraws itself inside its hard shell."
Flareon,"Flareon’s fluffy fur has a functional purpose—it releases heat into the air so that its body does not get excessively hot. This Pokémon’s body temperature can rise to a maximum of 1,650 degrees Fahrenheit."
Porygon,Porygon is capable of reverting itself entirely back to program data and entering cyberspace. This Pokémon is copy protected so it cannot be duplicated by copying.
Jolteon,"Jolteon’s cells generate a low level of electricity. This power is amplified by the static electricity of its fur, enabling the Pokémon to drop thunderbolts. The bristling fur is made of electrically charged needles."
Eevee,Eevee has an unstable genetic makeup that suddenly mutates due to the environment in which it lives. Radiation from various stones causes this Pokémon to evolve.
Vaporeon,Vaporeon underwent a spontaneous mutation and grew fins and gills that allow it to live underwater. This Pokémon has the ability to freely control water.
Ditto,"Ditto rearranges its cell structure to transform itself into other shapes. However, if it tries to transform itself into something by relying on its memory, this Pokémon manages to get details wrong."
Lapras,"People have driven Lapras almost to the point of extinction. In the evenings, this Pokémon is said to sing plaintively as it seeks what few others of its kind still remain."
Gyarados,"Once Gyarados goes on a rampage, its ferociously violent blood doesn’t calm until it has burned everything down. There are records of this Pokémon’s rampages lasting a whole month."
Tauros,"This Pokémon is not satisfied unless it is rampaging at all times. If there is no opponent for Tauros to battle, it will charge at thick trees and knock them down to calm itself."
Magikarp,"Magikarp is virtually useless in battle as it can only splash around. As a result, it is considered to be weak. However, it is actually a very hardy Pokémon that can survive in any body of water no matter how polluted it is."
Magmar,"In battle, Magmar blows out intensely hot flames from all over its body to intimidate its opponent. This Pokémon’s fiery bursts create heat waves that ignite grass and trees in its surroundings."
